0,1,2
acute rhinosinusitis,Sarcoidosis,"Age: 38; Sex: M; Initial evidence: Do you have pain somewhere, related to your reason for consulting? Yes; Evidence: ; Do you have swollen or painful lymph nodes? Yes; Do you have pain somewhere, related to your reason for consulting? Yes; Characterize your pain: sensitive; Characterize your pain: sharp; Do you feel pain somewhere? finger (ring finger)(L); Do you feel pain somewhere? finger (index)(R); Do you feel pain somewhere? finger (middle)(L); Do you feel pain somewhere? palmar face of the wrist(R); Do you feel pain somewhere? shoulder(R); How intense is the pain? 7; Does the pain radiate to another location? nowhere; How precisely is the pain located? 4; How fast did the pain appear? 0; Are you experiencing shortness of breath or difficulty breathing in a significant way? Yes; What color is the rash? NA; Do your lesions peel off? N; Is the rash swollen? 0; Where is the affected region located? nowhere; How intense is the pain caused by the rash? 0; Is the lesion (or are the lesions) larger than 1cm? N; How severe is the itching? 0; Have you traveled out of the country in the last 4 weeks? N"
bronchitis,URTI,"Age: 13; Sex: M; Initial evidence: Do you have pain somewhere, related to your reason for consulting? Yes; Evidence: ; Have you been in contact with a person with similar symptoms in the past 2 weeks? Yes; Do you live with 4 or more people? Yes; Do you attend or work in a daycare? Yes; Do you have pain somewhere, related to your reason for consulting? Yes; Characterize your pain: sensitive; Characterize your pain: heavy; Do you feel pain somewhere? occiput; Do you feel pain somewhere? temple(R); How intense is the pain? 5; Does the pain radiate to another location? nowhere; How precisely is the pain located? 6; How fast did the pain appear? 2; Do you have a cough that produces colored or more abundant sputum than usual? Yes; Do you have a sore throat? Yes; Do you have diffuse (widespread) muscle pain? Yes; Do you have nasal congestion or a clear runny nose? Yes; Do you have a cough? Yes; Have you traveled out of the country in the last 4 weeks? N; Are you exposed to secondhand cigarette smoke on a daily basis? Yes"
acute bronchitis,Bronchitis,"Age: 27; Sex: F; Initial evidence: Do you have a cough that produces colored or more abundant sputum than usual? Yes; Evidence: ; Do you have pain somewhere, related to your reason for consulting? Yes; Characterize your pain: burning; Do you feel pain somewhere? lower chest; Do you feel pain somewhere? pharynx; Do you feel pain somewhere? posterior chest wall(L); How intense is the pain? 5; Does the pain radiate to another location? nowhere; How precisely is the pain located? 5; How fast did the pain appear? 3; Are you experiencing shortness of breath or difficulty breathing in a significant way? Yes; Do you have a cough that produces colored or more abundant sputum than usual? Yes; Do you smoke cigarettes? Yes; Do you have a chronic obstructive pulmonary disease (COPD)? Yes; Do you have nasal congestion or a clear runny nose? Yes; Do you have a cough? Yes; Have you traveled out of the country in the last 4 weeks? N; Are your vaccinations up to date? Yes; Have you noticed a wheezing sound when you exhale? Yes"
acute rhinosinusitis,Sarcoidosis,"Age: 17; Sex: F; Initial evidence: Have you had any vaginal discharge? Yes; Evidence: ; Do you have pain somewhere, related to your reason for consulting? Yes; Characterize your pain: sensitive; Characterize your pain: sharp; Do you feel pain somewhere? finger (little finger)(R); Do you feel pain somewhere? finger (little finger)(L); Do you feel pain somewhere? dorsal aspect of the wrist(R); Do you feel pain somewhere? dorsal aspect of the wrist(L); Do you feel pain somewhere? shoulder(L); How intense is the pain? 5; Does the pain radiate to another location? nowhere; How precisely is the pain located? 1; How fast did the pain appear? 2; Are you experiencing shortness of breath or difficulty breathing in a significant way? Yes; Are you significantly overweight compared to people of the same height as you? Yes; Have you noticed a diffuse (widespread) redness in one or both eyes? Yes; What color is the rash? NA; Do your lesions peel off? N; Is the rash swollen? 0; Where is the affected region located? nowhere; How intense is the pain caused by the rash? 0; Is the lesion (or are the lesions) larger than 1cm? N; How severe is the itching? 0; Have you had any vaginal discharge? Yes; Have you traveled out of the country in the last 4 weeks? N"
acute bronchitis,PSVT,"Age: 39; Sex: F; Initial evidence: Are you experiencing shortness of breath or difficulty breathing in a significant way? Yes; Evidence: ; Do you feel anxious? Yes; Do you regularly drink coffee or tea? Yes; Characterize your pain: NA; Do you feel pain somewhere? nowhere; How intense is the pain? 0; Does the pain radiate to another location? nowhere; How precisely is the pain located? 0; How fast did the pain appear? 0; Do you regularly take stimulant drugs? Yes; Are you experiencing shortness of breath or difficulty breathing in a significant way? Yes; Do you feel slightly dizzy or lightheaded? Yes; Do you feel your heart is beating fast (racing), irregularly (missing a beat) or do you feel palpitations? Yes; Have you traveled out of the country in the last 4 weeks? N; Have you recently taken decongestants or other substances that may have stimulant effects? Yes"
Guillain-Barré syndrome,Guillain-Barré syndrome,"Age: 30; Sex: M; Initial evidence: Have you recently had numbness, loss of sensation or tingling, in both arms and legs and around your mouth? Yes; Evidence: ; Have you recently had a viral infection? Yes; Are you experiencing shortness of breath or difficulty breathing in a significant way? Yes; Have you noticed weakness in your facial muscles and/or eyes? Yes; Do you feel weakness in both arms and/or both legs? Yes; Have you recently had numbness, loss of sensation or tingling, in both arms and legs and around your mouth? Yes; Did you previously, or do you currently, have any weakness/paralysis in one or more of your limbs or in your face? Yes; Have you traveled out of the country in the last 4 weeks? N"
acute bronchitis,Acute pulmonary edema,"Age: 36; Sex: F; Initial evidence: Do you have symptoms that are increased with physical exertion but alleviated with rest? Yes; Evidence: ; Have you ever had fluid in your lungs? Yes; Have you had significantly increased sweating? Yes; Do you have pain somewhere, related to your reason for consulting? Yes; Characterize your pain: tedious; Characterize your pain: sensitive; Do you feel pain somewhere? ankle(L); Do you feel pain somewhere? upper chest; Do you feel pain somewhere? calf(L); Do you feel pain somewhere? posterior chest wall(R); Do you feel pain somewhere? posterior chest wall(L); How intense is the pain? 4; Does the pain radiate to another location? biceps(L); Does the pain radiate to another location? jaw; How precisely is the pain located? 3; How fast did the pain appear? 3; Are you experiencing shortness of breath or difficulty breathing in a significant way? Yes; Do you have bouts of choking or shortness of breath that wake you up at night? Yes; Do you have heart failure? Yes; Do you have swelling in one or more areas of your body? Yes; Where is the swelling located? ankle(L); Where is the swelling located? tibia(L); Have you traveled out of the country in the last 4 weeks? N; Are your symptoms worse when lying down and alleviated while sitting up? Yes; Do you have symptoms that are increased with physical exertion but alleviated with rest? Yes"
spontaneous pneumothorax,Bronchitis,"Age: 74; Sex: M; Initial evidence: Do you have pain somewhere, related to your reason for consulting? Yes; Evidence: ; Do you have pain somewhere, related to your reason for consulting? Yes; Characterize your pain: sensitive; Characterize your pain: burning; Do you feel pain somewhere? lower chest; Do you feel pain somewhere? side of the chest(L); Do you feel pain somewhere? upper chest; Do you feel pain somewhere? pharynx; Do you feel pain somewhere? posterior chest wall(L); How intense is the pain? 2; Does the pain radiate to another location? nowhere; How precisely is the pain located? 1; How fast did the pain appear? 2; Are you experiencing shortness of breath or difficulty breathing in a significant way? Yes; Do you have a cough that produces colored or more abundant sputum than usual? Yes; Do you smoke cigarettes? Yes; Do you have a chronic obstructive pulmonary disease (COPD)? Yes; Do you have a cough? Yes; Have you traveled out of the country in the last 4 weeks? N; Are your vaccinations up to date? Yes; Have you noticed a wheezing sound when you exhale? Yes; Are your symptoms more prominent at night? Yes"
cluster headache,Influenza,"Age: 3; Sex: M; Initial evidence: Do you have a sore throat? Yes; Evidence: ; Have you had significantly increased sweating? Yes; Do you have pain somewhere, related to your reason for consulting? Yes; Characterize your pain: sensitive; Characterize your pain: heavy; Characterize your pain: exhausting; Do you feel pain somewhere? side of the neck(R); Do you feel pain somewhere? side of the neck(L); Do you feel pain somewhere? top of the head; Do you feel pain somewhere? forehead; Do you feel pain somewhere? occiput; How intense is the pain? 7; Does the pain radiate to another location? nowhere; How precisely is the pain located? 4; How fast did the pain appear? 0; Do you smoke cigarettes? Yes; Do you have a fever (either felt or measured with a thermometer)? Yes; Do you have a sore throat? Yes; Do you have any lesions, redness or problems on your skin that you believe are related to the condition you are consulting for? Yes; What color is the rash? pink; Do your lesions peel off? N; Is the rash swollen? 4; Where is the affected region located? back of the neck; Where is the affected region located? side of the neck(R); Where is the affected region located? forehead; How intense is the pain caused by the rash? 6; Is the lesion (or are the lesions) larger than 1cm? Y; How severe is the itching? 5; Do you have a cough? Yes; Have you traveled out of the country in the last 4 weeks? N"
spontaneous pneumothorax,Spontaneous pneumothorax,"Age: 72; Sex: M; Initial evidence: Do you have chest pain even at rest? Yes; Evidence: ; Do you have chest pain even at rest? Yes; Do you have pain somewhere, related to your reason for consulting? Yes; Characterize your pain: heartbreaking; Characterize your pain: a knife stroke; Do you feel pain somewhere? side of the chest(R); Do you feel pain somewhere? upper chest; Do you feel pain somewhere? breast(R); Do you feel pain somewhere? breast(L); How intense is the pain? 10; Does the pain radiate to another location? nowhere; How precisely is the pain located? 3; How fast did the pain appear? 8; Are you experiencing shortness of breath or difficulty breathing in a significant way? Yes; Do you smoke cigarettes? Yes; Have you traveled out of the country in the last 4 weeks? N; Do you have pain that is increased when you breathe in deeply? Yes"
acute rhinosinusitis,PSVT,"Age: 30; Sex: M; Initial evidence: Do you have pain somewhere, related to your reason for consulting? Yes; Evidence: ; Do you feel anxious? Yes; Do you regularly drink coffee or tea? Yes; Do you have pain somewhere, related to your reason for consulting? Yes; Characterize your pain: heavy; Characterize your pain: a pulse; Do you feel pain somewhere? back of head; Do you feel pain somewhere? top of the head; How intense is the pain? 4; Does the pain radiate to another location? nowhere; How precisely is the pain located? 8; How fast did the pain appear? 8; Do you consume energy drinks regularly? Yes; Are you experiencing shortness of breath or difficulty breathing in a significant way? Yes; Do you feel lightheaded and dizzy or do you feel like you are about to faint? Yes; Do you feel your heart is beating fast (racing), irregularly (missing a beat) or do you feel palpitations? Yes; Have you traveled out of the country in the last 4 weeks? N; Have you recently taken decongestants or other substances that may have stimulant effects? Yes"
spontaneous pneumothorax,Pericarditis,"Age: 62; Sex: F; Initial evidence: Are your symptoms worse when lying down and alleviated while sitting up? Yes; Evidence: ; Have you ever had a pericarditis? Yes; Do you have pain somewhere, related to your reason for consulting? Yes; Characterize your pain: a knife stroke; Characterize your pain: sharp; Do you feel pain somewhere? lower chest; Do you feel pain somewhere? upper chest; Do you feel pain somewhere? breast(R); Do you feel pain somewhere? epigastric; How intense is the pain? 9; Does the pain radiate to another location? thoracic spine; Does the pain radiate to another location? posterior chest wall(R); How precisely is the pain located? 6; How fast did the pain appear? 9; Do you feel your heart is beating fast (racing), irregularly (missing a beat) or do you feel palpitations? Yes; Have you traveled out of the country in the last 4 weeks? N; Are your symptoms worse when lying down and alleviated while sitting up? Yes"
hiv (initial infection),HIV (initial infection),"Age: 0; Sex: F; Initial evidence: Have you had diarrhea or an increase in stool frequency? Yes; Evidence: ; Do you have swollen or painful lymph nodes? Yes; Have you ever had a sexually transmitted infection? Yes; Have you had diarrhea or an increase in stool frequency? Yes; Do you have pain somewhere, related to your reason for consulting? Yes; Characterize your pain: tedious; Characterize your pain: a pulse; Characterize your pain: exhausting; Do you feel pain somewhere? back of the neck; Do you feel pain somewhere? cervical spine; Do you feel pain somewhere? occiput; Do you feel pain somewhere? temple(R); How intense is the pain? 8; Does the pain radiate to another location? nowhere; How precisely is the pain located? 6; How fast did the pain appear? 6; Are you currently using intravenous drugs? Yes; Do you feel so tired that you are unable to do your usual activities or are you stuck in your bed all day long? Yes; Do you have a fever (either felt or measured with a thermometer)? Yes; Have you had unprotected sex with more than one partner in the last 6 months? Yes; Do you have any lesions, redness or problems on your skin that you believe are related to the condition you are consulting for? Yes; What color is the rash? pale; Do your lesions peel off? N; Is the rash swollen? 3; Where is the affected region located? lower gum; Where is the affected region located? upper gum; Where is the affected region located? labia majora(R); Where is the affected region located? labia majora(L); Where is the affected region located? internal cheek(R); How intense is the pain caused by the rash? 2; Is the lesion (or are the lesions) larger than 1cm? Y; How severe is the itching? 0; Do you have diffuse (widespread) muscle pain? Yes; Have you had an involuntary weight loss over the last 3 months? Yes; Have you had sexual intercourse with an HIV-positive partner in the past 12 months? Yes; Have you traveled out of the country in the last 4 weeks? N"
anemia,Anemia,"Age: 19; Sex: F; Initial evidence: Do you have pain somewhere, related to your reason for consulting? Yes; Evidence: ; Have you ever had a diagnosis of anemia? Yes; Do you have any family members who have been diagnosed with anemia? Yes; Do you have pain somewhere, related to your reason for consulting? Yes; Characterize your pain: exhausting; Do you feel pain somewhere? back of head; Do you feel pain somewhere? top of the head; Do you feel pain somewhere? forehead; Do you feel pain somewhere? temple(R); Do you feel pain somewhere? temple(L); How intense is the pain? 4; Does the pain radiate to another location? nowhere; How precisely is the pain located? 8; How fast did the pain appear? 2; Are you experiencing shortness of breath or difficulty breathing in a significant way? Yes; Do you constantly feel fatigued or do you have non-restful sleep? Yes; Have you recently had stools that were black (like coal)? Yes; Do you have very abundant or very long menstruation periods? Yes; Are you taking any new oral anticoagulants ((NOACs)? Yes; Is your skin much paler than usual? Yes; Do you think you are pregnant or are you currently pregnant? Yes; Have you traveled out of the country in the last 4 weeks? N; Is your BMI less than 18.5, or are you underweight? Yes"
acute bronchitis,Acute laryngitis,"Age: 67; Sex: F; Initial evidence: Do you have a cough? Yes; Evidence: ; Do you attend or work in a daycare? Yes; Do you have pain somewhere, related to your reason for consulting? Yes; Characterize your pain: sensitive; Do you feel pain somewhere? tonsil(R); Do you feel pain somewhere? thyroid cartilage; Do you feel pain somewhere? palace; Do you feel pain somewhere? pharynx; Do you feel pain somewhere? under the jaw; How intense is the pain? 4; Does the pain radiate to another location? nowhere; How precisely is the pain located? 8; How fast did the pain appear? 5; Do you smoke cigarettes? Yes; Have you had a cold in the last 2 weeks? Yes; Do you have a cough? Yes; Have you traveled out of the country in the last 4 weeks? N; Have you noticed that the tone of your voice has become deeper, softer or hoarse? Yes"
spontaneous pneumothorax,Inguinal hernia,"Age: 63; Sex: F; Initial evidence: Are the symptoms or pain increased with coughing, with an effort like lifting a weight or from forcing a bowel movement? Yes; Evidence: ; Do you have pain somewhere, related to your reason for consulting? Yes; Characterize your pain: heavy; Do you feel pain somewhere? iliac fossa(R); Do you feel pain somewhere? hip(R); How intense is the pain? 4; Does the pain radiate to another location? nowhere; How precisely is the pain located? 2; How fast did the pain appear? 2; What color is the rash? NA; Do your lesions peel off? N; Is the rash swollen? 0; Where is the affected region located? nowhere; How intense is the pain caused by the rash? 0; Is the lesion (or are the lesions) larger than 1cm? N; How severe is the itching? 0; Have you been able to pass stools or gas since your symptoms increased? Yes; Were you born prematurely or did you suffer any complication at birth? Yes; Do you have intense coughing fits? Yes; Have you traveled out of the country in the last 4 weeks? N; Are the symptoms or pain increased with coughing, with an effort like lifting a weight or from forcing a bowel movement? Yes"
spontaneous pneumothorax,Myocarditis,"Age: 29; Sex: F; Initial evidence: Are your symptoms worse when lying down and alleviated while sitting up? Yes; Evidence: ; Have you recently had a viral infection? Yes; Do you have pain somewhere, related to your reason for consulting? Yes; Characterize your pain: sensitive; Do you feel pain somewhere? lower chest; Do you feel pain somewhere? upper chest; Do you feel pain somewhere? breast(R); Do you feel pain somewhere? breast(L); How intense is the pain? 6; Does the pain radiate to another location? nowhere; How precisely is the pain located? 4; How fast did the pain appear? 4; Do you feel out of breath with minimal physical effort? Yes; Are you experiencing shortness of breath or difficulty breathing in a significant way? Yes; Have you noticed any new fatigue, generalized and vague discomfort, diffuse (widespread) muscle aches or a change in your general well-being related to your consultation today? Yes; Have you traveled out of the country in the last 4 weeks? N; Are your symptoms worse when lying down and alleviated while sitting up? Yes"
spontaneous pneumothorax,Pericarditis,"Age: 29; Sex: M; Initial evidence: Do you have pain somewhere, related to your reason for consulting? Yes; Evidence: ; Have you recently had a viral infection? Yes; Have you ever had a pericarditis? Yes; Do you have pain somewhere, related to your reason for consulting? Yes; Characterize your pain: a knife stroke; Characterize your pain: sharp; Do you feel pain somewhere? lower chest; Do you feel pain somewhere? upper chest; Do you feel pain somewhere? breast(R); Do you feel pain somewhere? breast(L); How intense is the pain? 10; Does the pain radiate to another location? thoracic spine; Does the pain radiate to another location? posterior chest wall(R); Does the pain radiate to another location? posterior chest wall(L); How precisely is the pain located? 2; How fast did the pain appear? 6; Do you feel your heart is beating fast (racing), irregularly (missing a beat) or do you feel palpitations? Yes; Have you traveled out of the country in the last 4 weeks? N; Do you have pain that is increased when you breathe in deeply? Yes"
cluster headache,Pancreatic neoplasm,"Age: 32; Sex: F; Initial evidence: Do you have pain somewhere, related to your reason for consulting? Yes; Evidence: ; Do you have pain somewhere, related to your reason for consulting? Yes; Characterize your pain: sensitive; Do you feel pain somewhere? flank(L); Do you feel pain somewhere? hypochondrium(L); Do you feel pain somewhere? belly; Do you feel pain somewhere? epigastric; How intense is the pain? 2; Does the pain radiate to another location? nowhere; How precisely is the pain located? 3; How fast did the pain appear? 2; Do you have diabetes? Yes; Are you significantly overweight compared to people of the same height as you? Yes; Do you have any lesions, redness or problems on your skin that you believe are related to the condition you are consulting for? Yes; What color is the rash? yellow; Do your lesions peel off? N; Is the rash swollen? 2; Where is the affected region located? epigastric; How intense is the pain caused by the rash? 1; Is the lesion (or are the lesions) larger than 1cm? Y; How severe is the itching? 4; Have you had an involuntary weight loss over the last 3 months? Yes; Do you have pale stools and dark urine? Yes; Have you traveled out of the country in the last 4 weeks? N; Are there members of your family who have been diagnosed with pancreatic cancer? Yes"
gastroesophageal reflux disease,GERD,"Age: 15; Sex: M; Initial evidence: Do you have symptoms that get worse after eating? Yes; Evidence: ; Do you have pain somewhere, related to your reason for consulting? Yes; Characterize your pain: haunting; Characterize your pain: tugging; Characterize your pain: burning; Characterize your pain: sickening; Do you feel pain somewhere? lower chest; Do you feel pain somewhere? upper chest; Do you feel pain somewhere? epigastric; How intense is the pain? 7; Does the pain radiate to another location? lower chest; How precisely is the pain located? 6; How fast did the pain appear? 4; Are you significantly overweight compared to people of the same height as you? Yes; Do you drink alcohol excessively or do you have an addiction to alcohol? Yes; Do you smoke cigarettes? Yes; Do you have a hiatal hernia? Yes; Do you have asthma or have you ever had to use a bronchodilator in the past? Yes; Do you have a burning sensation that starts in your stomach then goes up into your throat, and can be associated with a bitter taste in your mouth? Yes; Do you have a cough? Yes; Have you traveled out of the country in the last 4 weeks? N; Do you have symptoms that get worse after eating? Yes"
bronchitis,URTI,"Age: 62; Sex: M; Initial evidence: Do you have nasal congestion or a clear runny nose? Yes; Evidence: ; Have you been in contact with a person with similar symptoms in the past 2 weeks? Yes; Do you live with 4 or more people? Yes; Do you attend or work in a daycare? Yes; Have you had significantly increased sweating? Yes; Do you have pain somewhere, related to your reason for consulting? Yes; Characterize your pain: sensitive; Characterize your pain: heavy; Do you feel pain somewhere? top of the head; Do you feel pain somewhere? forehead; Do you feel pain somewhere? cheek(L); Do you feel pain somewhere? occiput; Do you feel pain somewhere? temple(R); How intense is the pain? 4; Does the pain radiate to another location? nowhere; How precisely is the pain located? 6; How fast did the pain appear? 1; Do you smoke cigarettes? Yes; Do you have a fever (either felt or measured with a thermometer)? Yes; Do you have a sore throat? Yes; Do you have diffuse (widespread) muscle pain? Yes; Do you have nasal congestion or a clear runny nose? Yes; Have you traveled out of the country in the last 4 weeks? N; Are you exposed to secondhand cigarette smoke on a daily basis? Yes"
asthma,Bronchospasm / acute asthma exacerbation,Age: 74; Sex: F; Initial evidence: Have you noticed a wheezing sound when you exhale? Yes; Evidence: ; Do you have any family members who have asthma? Yes; Have you had a cold in the last 2 weeks? Yes; Have you been diagnosed with chronic sinusitis? Yes; Do you have asthma or have you ever had to use a bronchodilator in the past? Yes; Do you have a cough? Yes; Have you traveled out of the country in the last 4 weeks? N; Do you live in in a big city? Yes; Have you noticed a wheezing sound when you exhale? Yes; Are you exposed to secondhand cigarette smoke on a daily basis? Yes; Are you more likely to develop common allergies than the general population? Yes
