0,1,2
bronchitis,Viral pharyngitis,"Age: 19; Sex: M; Initial evidence: Do you have a fever (either felt or measured with a thermometer)? Yes; Evidence: ; Have you been in contact with a person with similar symptoms in the past 2 weeks? Yes; Do you live with 4 or more people? Yes; Do you attend or work in a daycare? Yes; Do you have pain somewhere, related to your reason for consulting? Yes; Characterize your pain: sensitive; Characterize your pain: burning; Do you feel pain somewhere? tonsil(R); Do you feel pain somewhere? tonsil(L); Do you feel pain somewhere? thyroid cartilage; Do you feel pain somewhere? palace; Do you feel pain somewhere? under the jaw; How intense is the pain? 4; Does the pain radiate to another location? nowhere; How precisely is the pain located? 10; How fast did the pain appear? 4; Do you have a fever (either felt or measured with a thermometer)? Yes; Do you have nasal congestion or a clear runny nose? Yes; Do you have a cough? Yes; Have you traveled out of the country in the last 4 weeks? N"
tuberculosis,Viral pharyngitis,"Age: 26; Sex: M; Initial evidence: Have you been coughing up blood? Yes; Evidence: ; Have you been in contact with a person with similar symptoms in the past 2 weeks? Yes; Have you been coughing up blood? Yes; Do you live with 4 or more people? Yes; Do you have pain somewhere, related to your reason for consulting? Yes; Characterize your pain: sensitive; Characterize your pain: burning; Do you feel pain somewhere? tonsil(R); Do you feel pain somewhere? tonsil(L); Do you feel pain somewhere? thyroid cartilage; Do you feel pain somewhere? palace; Do you feel pain somewhere? under the jaw; How intense is the pain? 3; Does the pain radiate to another location? nowhere; How precisely is the pain located? 5; How fast did the pain appear? 5; Do you have a fever (either felt or measured with a thermometer)? Yes; Do you have nasal congestion or a clear runny nose? Yes; Do you have a cough? Yes; Have you traveled out of the country in the last 4 weeks? N; Are you immunosuppressed? Yes"
anemia,Anemia,"Age: 26; Sex: M; Initial evidence: Do you constantly feel fatigued or do you have non-restful sleep? Yes; Evidence: ; Do you have a poor diet? Yes; Do you have any family members who have been diagnosed with anemia? Yes; Do you have pain somewhere, related to your reason for consulting? Yes; Characterize your pain: tugging; Characterize your pain: a cramp; Characterize your pain: exhausting; Do you feel pain somewhere? forehead; How intense is the pain? 5; Does the pain radiate to another location? nowhere; How precisely is the pain located? 2; How fast did the pain appear? 0; Are you experiencing shortness of breath or difficulty breathing in a significant way? Yes; Do you feel lightheaded and dizzy or do you feel like you are about to faint? Yes; Do you constantly feel fatigued or do you have non-restful sleep? Yes; Do you have chronic kidney failure? Yes; Have you recently had stools that were black (like coal)? Yes; Are you taking any new oral anticoagulants ((NOACs)? Yes; Is your skin much paler than usual? Yes; Have you traveled out of the country in the last 4 weeks? N; Is your BMI less than 18.5, or are you underweight? Yes"
myasthenia gravis,Influenza,"Age: 27; Sex: M; Initial evidence: Do you have diffuse (widespread) muscle pain? Yes; Evidence: ; Have you had significantly increased sweating? Yes; Do you have pain somewhere, related to your reason for consulting? Yes; Characterize your pain: heavy; Characterize your pain: exhausting; Do you feel pain somewhere? back of head; Do you feel pain somewhere? side of the neck(R); Do you feel pain somewhere? temple(R); How intense is the pain? 3; Does the pain radiate to another location? nowhere; How precisely is the pain located? 7; How fast did the pain appear? 6; Do you smoke cigarettes? Yes; Do you feel so tired that you are unable to do your usual activities or are you stuck in your bed all day long? Yes; Have you had chills or shivers? Yes; Do you have any lesions, redness or problems on your skin that you believe are related to the condition you are consulting for? Yes; What color is the rash? pink; Do your lesions peel off? N; Is the rash swollen? 2; Where is the affected region located? forehead; How intense is the pain caused by the rash? 3; Is the lesion (or are the lesions) larger than 1cm? Y; How severe is the itching? 0; Do you have diffuse (widespread) muscle pain? Yes; Have you recently had a loss of appetite or do you get full more quickly then usually? Yes; Do you have nasal congestion or a clear runny nose? Yes; Have you traveled out of the country in the last 4 weeks? N; Are you immunosuppressed? Yes"
gerd,Localized edema,"Age: 67; Sex: F; Initial evidence: Do you have pain somewhere, related to your reason for consulting? Yes; Evidence: ; Are you currently taking or have you recently taken anti-inflammatory drugs (NSAIDs)? Yes; Do you have a known issue with one of your heart valves? Yes; Do you take corticosteroids? Yes; Do you have pain somewhere, related to your reason for consulting? Yes; Characterize your pain: sensitive; Do you feel pain somewhere? ankle(R); Do you feel pain somewhere? ankle(L); Do you feel pain somewhere? dorsal aspect of the foot(R); Do you feel pain somewhere? dorsal aspect of the foot(L); Do you feel pain somewhere? sole(R); How intense is the pain? 3; Does the pain radiate to another location? nowhere; How precisely is the pain located? 5; How fast did the pain appear? 5; Have you gained weight recently? Yes; Have you ever had deep vein thrombosis (DVT)? Yes; Do you take a calcium channel blockers (medication)? Yes; Do you have swelling in one or more areas of your body? Yes; Where is the swelling located? ankle(L); Where is the swelling located? thigh(R); Where is the swelling located? thigh(L); Where is the swelling located? dorsal aspect of the foot(R); Where is the swelling located? dorsal aspect of the foot(L); Have you ever been diagnosed with obstructive sleep apnea (OSA)? Yes; Do you have a known kidney problem resulting in an inability to retain proteins? Yes; Have you traveled out of the country in the last 4 weeks? N"
allergic rhinitis,Anaphylaxis,"Age: 6; Sex: M; Initial evidence: Do you have any lesions, redness or problems on your skin that you believe are related to the condition you are consulting for? Yes; Evidence: ; Do you have a known severe food allergy? Yes; Do you have pain somewhere, related to your reason for consulting? Yes; Characterize your pain: sharp; Do you feel pain somewhere? flank(L); Do you feel pain somewhere? iliac fossa(R); Do you feel pain somewhere? iliac fossa(L); Do you feel pain somewhere? hypochondrium(R); How intense is the pain? 4; Does the pain radiate to another location? nowhere; How precisely is the pain located? 1; How fast did the pain appear? 8; Are you experiencing shortness of breath or difficulty breathing in a significant way? Yes; Do you feel lightheaded and dizzy or do you feel like you are about to faint? Yes; Do you have any lesions, redness or problems on your skin that you believe are related to the condition you are consulting for? Yes; What color is the rash? pink; Do your lesions peel off? N; Is the rash swollen? 4; Where is the affected region located? back of the neck; Where is the affected region located? biceps(R); Where is the affected region located? biceps(L); Where is the affected region located? mouth; Where is the affected region located? thyroid cartilage; How intense is the pain caused by the rash? 1; Is the lesion (or are the lesions) larger than 1cm? Y; How severe is the itching? 8; Do you have swelling in one or more areas of your body? Yes; Where is the swelling located? nose; Have you noticed a high pitched sound when breathing in? Yes; Have you traveled out of the country in the last 4 weeks? N; Have you noticed a wheezing sound when you exhale? Yes; Are you more likely to develop common allergies than the general population? Yes"
anemia,Anemia,"Age: 32; Sex: F; Initial evidence: Do you feel lightheaded and dizzy or do you feel like you are about to faint? Yes; Evidence: ; Do you have a poor diet? Yes; Have you ever had a diagnosis of anemia? Yes; Do you have any family members who have been diagnosed with anemia? Yes; Do you have pain somewhere, related to your reason for consulting? Yes; Characterize your pain: exhausting; Do you feel pain somewhere? back of head; Do you feel pain somewhere? forehead; Do you feel pain somewhere? temple(R); How intense is the pain? 4; Does the pain radiate to another location? nowhere; How precisely is the pain located? 2; How fast did the pain appear? 5; Are you experiencing shortness of breath or difficulty breathing in a significant way? Yes; Do you feel lightheaded and dizzy or do you feel like you are about to faint? Yes; Do you constantly feel fatigued or do you have non-restful sleep? Yes; Do you have very abundant or very long menstruation periods? Yes; Are you taking any new oral anticoagulants ((NOACs)? Yes; Is your skin much paler than usual? Yes; Have you noticed light red blood or blood clots in your stool? Yes; Have you traveled out of the country in the last 4 weeks? N; Is your BMI less than 18.5, or are you underweight? Yes"
pulmonary embolism,Pulmonary embolism,"Age: 52; Sex: M; Initial evidence: Have you been coughing up blood? Yes; Evidence: ; Have you been coughing up blood? Yes; Do you have pain somewhere, related to your reason for consulting? Yes; Characterize your pain: sensitive; Characterize your pain: a knife stroke; Do you feel pain somewhere? side of the chest(R); Do you feel pain somewhere? side of the chest(L); Do you feel pain somewhere? scapula(R); Do you feel pain somewhere? scapula(L); Do you feel pain somewhere? posterior chest wall(R); How intense is the pain? 9; Does the pain radiate to another location? side of the chest(R); Does the pain radiate to another location? side of the chest(L); Does the pain radiate to another location? scapula(R); Does the pain radiate to another location? scapula(L); Does the pain radiate to another location? breast(R); How precisely is the pain located? 3; How fast did the pain appear? 2; Are you experiencing shortness of breath or difficulty breathing in a significant way? Yes; Have you ever had deep vein thrombosis (DVT)? Yes; Have you been unable to move or get up for more than 3 consecutive days within the last 4 weeks? Yes; Do you have swelling in one or more areas of your body? Yes; Where is the swelling located? posterior aspect of the ankle(R); Where is the swelling located? posterior aspect of the ankle(L); Did you lose consciousness? Yes; Have you had surgery within the last month? Yes; Have you traveled out of the country in the last 4 weeks? N; Do you have pain that is increased when you breathe in deeply? Yes"
acute bronchitis,Localized edema,"Age: 32; Sex: F; Initial evidence: Do you have pain somewhere, related to your reason for consulting? Yes; Evidence: ; Do you take corticosteroids? Yes; Do you have pain somewhere, related to your reason for consulting? Yes; Characterize your pain: tedious; Characterize your pain: sensitive; Characterize your pain: heavy; Characterize your pain: sharp; Do you feel pain somewhere? ankle(L); Do you feel pain somewhere? lateral side of the foot(R); Do you feel pain somewhere? thigh(R); Do you feel pain somewhere? dorsal aspect of the foot(L); Do you feel pain somewhere? sole(L); How intense is the pain? 7; Does the pain radiate to another location? nowhere; How precisely is the pain located? 5; How fast did the pain appear? 5; Have you gained weight recently? Yes; Have you ever had deep vein thrombosis (DVT)? Yes; Have you ever had surgery to remove lymph nodes? Yes; Do you take a calcium channel blockers (medication)? Yes; Do you have swelling in one or more areas of your body? Yes; Where is the swelling located? ankle(R); Where is the swelling located? ankle(L); Where is the swelling located? thigh(R); Where is the swelling located? dorsal aspect of the foot(R); Where is the swelling located? dorsal aspect of the foot(L); Do you have a known kidney problem resulting in an inability to retain proteins? Yes; Have you traveled out of the country in the last 4 weeks? N"
gastroesophageal reflux disease,GERD,"Age: 7; Sex: M; Initial evidence: Do you have a burning sensation that starts in your stomach then goes up into your throat, and can be associated with a bitter taste in your mouth? Yes; Evidence: ; Do you have pain somewhere, related to your reason for consulting? Yes; Characterize your pain: haunting; Characterize your pain: sensitive; Characterize your pain: tugging; Characterize your pain: burning; Characterize your pain: sickening; Characterize your pain: scary; Do you feel pain somewhere? upper chest; Do you feel pain somewhere? hypochondrium(R); Do you feel pain somewhere? hypochondrium(L); Do you feel pain somewhere? belly; Do you feel pain somewhere? epigastric; How intense is the pain? 8; Does the pain radiate to another location? upper chest; How precisely is the pain located? 2; How fast did the pain appear? 1; Do you drink alcohol excessively or do you have an addiction to alcohol? Yes; Do you have a hiatal hernia? Yes; Do you have asthma or have you ever had to use a bronchodilator in the past? Yes; Do you have a burning sensation that starts in your stomach then goes up into your throat, and can be associated with a bitter taste in your mouth? Yes; Do you have a cough? Yes; Have you traveled out of the country in the last 4 weeks? N; Do you have symptoms that get worse after eating? Yes; Are your symptoms worse when lying down and alleviated while sitting up? Yes"
bronchitis,Acute otitis media,"Age: 64; Sex: M; Initial evidence: Do you have a fever (either felt or measured with a thermometer)? Yes; Evidence: ; Are you currently being treated or have you recently been treated with an oral antibiotic for an ear infection? Yes; Do you have pain somewhere, related to your reason for consulting? Yes; Characterize your pain: sensitive; Characterize your pain: sharp; Do you feel pain somewhere? ear(R); Do you feel pain somewhere? ear(L); How intense is the pain? 6; Does the pain radiate to another location? nowhere; How precisely is the pain located? 10; How fast did the pain appear? 1; Do you have a fever (either felt or measured with a thermometer)? Yes; Are you more irritable or has your mood been very unstable recently? Yes; Do you have nasal congestion or a clear runny nose? Yes; Have you traveled out of the country in the last 4 weeks? N"
acute bronchitis,Acute pulmonary edema,"Age: 58; Sex: M; Initial evidence: Are your symptoms worse when lying down and alleviated while sitting up? Yes; Evidence: ; Have you ever had fluid in your lungs? Yes; Do you currently undergo dialysis? Yes; Have you had significantly increased sweating? Yes; Do you have pain somewhere, related to your reason for consulting? Yes; Characterize your pain: tedious; Characterize your pain: sensitive; Characterize your pain: tugging; Do you feel pain somewhere? lower chest; Do you feel pain somewhere? side of the chest(R); Do you feel pain somewhere? breast(R); Do you feel pain somewhere? breast(L); Do you feel pain somewhere? posterior chest wall(R); How intense is the pain? 6; Does the pain radiate to another location? scapula(L); Does the pain radiate to another location? shoulder(L); How precisely is the pain located? 1; How fast did the pain appear? 4; Do you have bouts of choking or shortness of breath that wake you up at night? Yes; Do you have high blood pressure or do you take medications to treat high blood pressure? Yes; Have you ever had a heart attack or do you have angina (chest pain)? Yes; Do you have heart failure? Yes; Do you have swelling in one or more areas of your body? Yes; Where is the swelling located? ankle(R); Where is the swelling located? ankle(L); Where is the swelling located? calf(L); Where is the swelling located? tibia(R); Have you noticed any new fatigue, generalized and vague discomfort, diffuse (widespread) muscle aches or a change in your general well-being related to your consultation today? Yes; Have you traveled out of the country in the last 4 weeks? N; Are your symptoms worse when lying down and alleviated while sitting up? Yes; Do you have symptoms that are increased with physical exertion but alleviated with rest? Yes"
acute coronary syndrome,Unstable angina,"Age: 73; Sex: M; Initial evidence: Are you feeling nauseous or do you feel like vomiting? Yes; Evidence: ; Do you find that your symptoms have worsened over the last 2 weeks and that progressively less effort is required to cause the symptoms? Yes; Do you have chest pain even at rest? Yes; Do you have pain somewhere, related to your reason for consulting? Yes; Characterize your pain: exhausting; Do you feel pain somewhere? lower chest; Do you feel pain somewhere? upper chest; Do you feel pain somewhere? breast(R); Do you feel pain somewhere? breast(L); Do you feel pain somewhere? epigastric; How intense is the pain? 10; Does the pain radiate to another location? biceps(R); Does the pain radiate to another location? biceps(L); Does the pain radiate to another location? thoracic spine; Does the pain radiate to another location? shoulder(R); Does the pain radiate to another location? shoulder(L); How precisely is the pain located? 2; How fast did the pain appear? 4; Do you have diabetes? Yes; Are you significantly overweight compared to people of the same height as you? Yes; Do you have high cholesterol or do you take medications to treat high cholesterol? Yes; Do you drink alcohol excessively or do you have an addiction to alcohol? Yes; Do you smoke cigarettes? Yes; Do you have high blood pressure or do you take medications to treat high blood pressure? Yes; Have you ever had a heart attack or do you have angina (chest pain)? Yes; Are you feeling nauseous or do you feel like vomiting? Yes; Have you traveled out of the country in the last 4 weeks? N; Do you have symptoms that are increased with physical exertion but alleviated with rest? Yes; Do you have close family members who had a cardiovascular disease problem before the age of 50? Yes"
bronchitis,Acute otitis media,"Age: 4; Sex: M; Initial evidence: Do you have nasal congestion or a clear runny nose? Yes; Evidence: ; Are you currently being treated or have you recently been treated with an oral antibiotic for an ear infection? Yes; Do you have pain somewhere, related to your reason for consulting? Yes; Characterize your pain: sensitive; Do you feel pain somewhere? ear(R); Do you feel pain somewhere? ear(L); How intense is the pain? 6; Does the pain radiate to another location? nowhere; How precisely is the pain located? 10; How fast did the pain appear? 3; Are you more irritable or has your mood been very unstable recently? Yes; Do you have nasal congestion or a clear runny nose? Yes; Do you have a cough? Yes; Have you traveled out of the country in the last 4 weeks? N"
spontaneous pneumothorax,Spontaneous rib fracture,"Age: 10; Sex: F; Initial evidence: Do you have pain that is increased with movement? Yes; Evidence: ; Do you have metastatic cancer? Yes; Do you have pain somewhere, related to your reason for consulting? Yes; Characterize your pain: heartbreaking; Characterize your pain: haunting; Characterize your pain: a knife stroke; Characterize your pain: violent; Characterize your pain: sharp; Do you feel pain somewhere? side of the chest(R); Do you feel pain somewhere? side of the chest(L); Do you feel pain somewhere? breast(R); Do you feel pain somewhere? posterior chest wall(L); How intense is the pain? 6; Does the pain radiate to another location? posterior chest wall(R); Does the pain radiate to another location? posterior chest wall(L); How precisely is the pain located? 7; How fast did the pain appear? 10; Do you drink alcohol excessively or do you have an addiction to alcohol? Yes; Do you have intense coughing fits? Yes; Have you traveled out of the country in the last 4 weeks? N; Do you have pain that is increased with movement? Yes; Do you have pain that is increased when you breathe in deeply? Yes"
acute pulmonary edema,Acute pulmonary edema,"Age: 23; Sex: M; Initial evidence: Are you experiencing shortness of breath or difficulty breathing in a significant way? Yes; Evidence: ; Have you ever had fluid in your lungs? Yes; Do you currently undergo dialysis? Yes; Do you have pain somewhere, related to your reason for consulting? Yes; Characterize your pain: sensitive; Characterize your pain: tugging; Characterize your pain: heavy; Do you feel pain somewhere? lower chest; Do you feel pain somewhere? ankle(R); Do you feel pain somewhere? side of the chest(R); Do you feel pain somewhere? posterior chest wall(R); Do you feel pain somewhere? posterior chest wall(L); How intense is the pain? 5; Does the pain radiate to another location? biceps(R); Does the pain radiate to another location? biceps(L); Does the pain radiate to another location? chin; Does the pain radiate to another location? shoulder(R); Does the pain radiate to another location? shoulder(L); How precisely is the pain located? 8; How fast did the pain appear? 8; Are you experiencing shortness of breath or difficulty breathing in a significant way? Yes; Do you have bouts of choking or shortness of breath that wake you up at night? Yes; Do you have high blood pressure or do you take medications to treat high blood pressure? Yes; Have you ever had a heart attack or do you have angina (chest pain)? Yes; Do you have heart failure? Yes; Do you have swelling in one or more areas of your body? Yes; Where is the swelling located? ankle(R); Where is the swelling located? calf(R); Where is the swelling located? calf(L); Where is the swelling located? tibia(L); Have you noticed any new fatigue, generalized and vague discomfort, diffuse (widespread) muscle aches or a change in your general well-being related to your consultation today? Yes; Have you traveled out of the country in the last 4 weeks? N; Are your symptoms worse when lying down and alleviated while sitting up? Yes; Do you have symptoms that are increased with physical exertion but alleviated with rest? Yes"
spontaneous pneumothorax,Acute laryngitis,"Age: 7; Sex: F; Initial evidence: Do you have pain somewhere, related to your reason for consulting? Yes; Evidence: ; Do you attend or work in a daycare? Yes; Do you have pain somewhere, related to your reason for consulting? Yes; Characterize your pain: sensitive; Do you feel pain somewhere? tonsil(R); Do you feel pain somewhere? tonsil(L); Do you feel pain somewhere? trachea; How intense is the pain? 5; Does the pain radiate to another location? nowhere; How precisely is the pain located? 2; How fast did the pain appear? 5; Have you had a cold in the last 2 weeks? Yes; Do you have a cough? Yes; Have you traveled out of the country in the last 4 weeks? N; Have you noticed that the tone of your voice has become deeper, softer or hoarse? Yes"
tuberculosis,Viral pharyngitis,"Age: 28; Sex: M; Initial evidence: Have you been coughing up blood? Yes; Evidence: ; Have you been in contact with a person with similar symptoms in the past 2 weeks? Yes; Have you been coughing up blood? Yes; Do you live with 4 or more people? Yes; Do you have pain somewhere, related to your reason for consulting? Yes; Characterize your pain: sensitive; Characterize your pain: burning; Do you feel pain somewhere? tonsil(R); Do you feel pain somewhere? tonsil(L); Do you feel pain somewhere? thyroid cartilage; Do you feel pain somewhere? palace; Do you feel pain somewhere? pharynx; How intense is the pain? 4; Does the pain radiate to another location? nowhere; How precisely is the pain located? 5; How fast did the pain appear? 4; Do you smoke cigarettes? Yes; Do you have a fever (either felt or measured with a thermometer)? Yes; Do you have nasal congestion or a clear runny nose? Yes; Have you traveled out of the country in the last 4 weeks? N"
acute coronary syndrome,Atrial fibrillation,Age: 0; Sex: M; Initial evidence: Do you have symptoms that are increased with physical exertion but alleviated with rest? Yes; Evidence: ; Do you have a known issue with one of your heart valves? Yes; Do you have severe Chronic Obstructive Pulmonary Disease (COPD)? Yes; Are you experiencing shortness of breath or difficulty breathing in a significant way? Yes; Do you have diabetes? Yes; Are you significantly overweight compared to people of the same height as you? Yes; Do you feel slightly dizzy or lightheaded? Yes; Do you have high blood pressure or do you take medications to treat high blood pressure? Yes; Have you ever had a heart attack or do you have angina (chest pain)? Yes; Have you traveled out of the country in the last 4 weeks? N; Do you have symptoms that are increased with physical exertion but alleviated with rest? Yes
