0,1,2
acute bronchitis,Localized edema,"Age: 26; Sex: F; Initial evidence: Do you have pain somewhere, related to your reason for consulting? Yes; Evidence: ; Are you currently taking or have you recently taken anti-inflammatory drugs (NSAIDs)? Yes; Do you have a known issue with one of your heart valves? Yes; Do you take corticosteroids? Yes; Do you have pain somewhere, related to your reason for consulting? Yes; Characterize your pain: tedious; Characterize your pain: sensitive; Characterize your pain: tugging; Do you feel pain somewhere? ankle(R); Do you feel pain somewhere? ankle(L); Do you feel pain somewhere? thigh(R); Do you feel pain somewhere? thigh(L); Do you feel pain somewhere? dorsal aspect of the foot(L); How intense is the pain? 8; Does the pain radiate to another location? nowhere; How precisely is the pain located? 4; How fast did the pain appear? 8; Do you take a calcium channel blockers (medication)? Yes; Do you have swelling in one or more areas of your body? Yes; Where is the swelling located? ankle(L); Where is the swelling located? thigh(R); Where is the swelling located? thigh(L); Where is the swelling located? dorsal aspect of the foot(L); Where is the swelling located? sole(R); Were you diagnosed with endocrine disease or a hormone dysfunction? Yes; Have you ever been diagnosed with obstructive sleep apnea (OSA)? Yes; Do you have a known kidney problem resulting in an inability to retain proteins? Yes; Have you traveled out of the country in the last 4 weeks? N"
cluster headache,Influenza,"Age: 42; Sex: F; Initial evidence: Have you recently had a loss of appetite or do you get full more quickly then usually? Yes; Evidence: ; Have you had significantly increased sweating? Yes; Do you have pain somewhere, related to your reason for consulting? Yes; Characterize your pain: heavy; Do you feel pain somewhere? back of the neck; Do you feel pain somewhere? side of the neck(R); Do you feel pain somewhere? side of the neck(L); Do you feel pain somewhere? top of the head; Do you feel pain somewhere? forehead; How intense is the pain? 5; Does the pain radiate to another location? nowhere; How precisely is the pain located? 5; How fast did the pain appear? 1; Do you smoke cigarettes? Yes; Do you feel so tired that you are unable to do your usual activities or are you stuck in your bed all day long? Yes; Do you have a fever (either felt or measured with a thermometer)? Yes; Have you had chills or shivers? Yes; Do you have any lesions, redness or problems on your skin that you believe are related to the condition you are consulting for? Yes; What color is the rash? pink; Do your lesions peel off? N; Is the rash swollen? 3; Where is the affected region located? back of the neck; Where is the affected region located? side of the neck(R); How intense is the pain caused by the rash? 6; Is the lesion (or are the lesions) larger than 1cm? Y; How severe is the itching? 1; Do you have diffuse (widespread) muscle pain? Yes; Have you recently had a loss of appetite or do you get full more quickly then usually? Yes; Do you have a cough? Yes; Have you traveled out of the country in the last 4 weeks? N; Are you immunosuppressed? Yes"
bronchitis,URTI,"Age: 103; Sex: M; Initial evidence: Do you have pain somewhere, related to your reason for consulting? Yes; Evidence: ; Have you been in contact with a person with similar symptoms in the past 2 weeks? Yes; Do you live with 4 or more people? Yes; Have you had significantly increased sweating? Yes; Do you have pain somewhere, related to your reason for consulting? Yes; Characterize your pain: tedious; Characterize your pain: sensitive; Characterize your pain: heavy; Do you feel pain somewhere? top of the head; Do you feel pain somewhere? cheek(R); Do you feel pain somewhere? cheek(L); Do you feel pain somewhere? temple(L); How intense is the pain? 8; Does the pain radiate to another location? nowhere; How precisely is the pain located? 2; How fast did the pain appear? 2; Do you smoke cigarettes? Yes; Do you have a fever (either felt or measured with a thermometer)? Yes; Do you have a sore throat? Yes; Do you have diffuse (widespread) muscle pain? Yes; Do you have nasal congestion or a clear runny nose? Yes; Do you have a cough? Yes; Have you traveled out of the country in the last 4 weeks? N"
acute bronchitis,Inguinal hernia,"Age: 21; Sex: M; Initial evidence: Do you have intense coughing fits? Yes; Evidence: ; Do you have pain somewhere, related to your reason for consulting? Yes; Characterize your pain: heavy; Do you feel pain somewhere? hip(R); Do you feel pain somewhere? testicle(R); Do you feel pain somewhere? testicle(L); How intense is the pain? 3; Does the pain radiate to another location? nowhere; How precisely is the pain located? 4; How fast did the pain appear? 5; Are you significantly overweight compared to people of the same height as you? Yes; Do you have any lesions, redness or problems on your skin that you believe are related to the condition you are consulting for? Yes; What color is the rash? pale; Do your lesions peel off? N; Is the rash swollen? 4; Where is the affected region located? iliac fossa(R); How intense is the pain caused by the rash? 2; Is the lesion (or are the lesions) larger than 1cm? Y; How severe is the itching? 0; Do you have intense coughing fits? Yes; Have you traveled out of the country in the last 4 weeks? N; Are the symptoms or pain increased with coughing, with an effort like lifting a weight or from forcing a bowel movement? Yes"
spontaneous pneumothorax,GERD,"Age: 7; Sex: M; Initial evidence: Are your symptoms worse when lying down and alleviated while sitting up? Yes; Evidence: ; Do you have pain somewhere, related to your reason for consulting? Yes; Characterize your pain: haunting; Characterize your pain: sensitive; Characterize your pain: a knife stroke; Characterize your pain: tugging; Characterize your pain: burning; Characterize your pain: sickening; Characterize your pain: scary; Do you feel pain somewhere? hypochondrium(R); Do you feel pain somewhere? hypochondrium(L); Do you feel pain somewhere? belly; How intense is the pain? 9; Does the pain radiate to another location? lower chest; Does the pain radiate to another location? upper chest; How precisely is the pain located? 4; How fast did the pain appear? 1; Are you significantly overweight compared to people of the same height as you? Yes; Do you smoke cigarettes? Yes; Do you have a hiatal hernia? Yes; Do you have asthma or have you ever had to use a bronchodilator in the past? Yes; Do you have a cough? Yes; Have you traveled out of the country in the last 4 weeks? N; Have you recently thrown up blood or something resembling coffee beans? Yes; Are your symptoms worse when lying down and alleviated while sitting up? Yes"
spontaneous pneumothorax,Boerhaave,"Age: 47; Sex: F; Initial evidence: Are you experiencing shortness of breath or difficulty breathing in a significant way? Yes; Evidence: ; Do you have pain somewhere, related to your reason for consulting? Yes; Characterize your pain: heartbreaking; Characterize your pain: a knife stroke; Characterize your pain: violent; Characterize your pain: sickening; Do you feel pain somewhere? lower chest; Do you feel pain somewhere? flank(R); Do you feel pain somewhere? upper chest; Do you feel pain somewhere? hypochondrium(L); Do you feel pain somewhere? belly; How intense is the pain? 9; Does the pain radiate to another location? thoracic spine; Does the pain radiate to another location? scapula(R); Does the pain radiate to another location? scapula(L); How precisely is the pain located? 3; How fast did the pain appear? 10; Are you experiencing shortness of breath or difficulty breathing in a significant way? Yes; Do you drink alcohol excessively or do you have an addiction to alcohol? Yes; Have you traveled out of the country in the last 4 weeks? N; Have you recently thrown up blood or something resembling coffee beans? Yes; Have you vomited several times or have you made several efforts to vomit? Yes"
chronic obstructive pulmonary disease (COPD),Acute COPD exacerbation / infection,Age: 57; Sex: M; Initial evidence: Do you have a cough that produces colored or more abundant sputum than usual? Yes; Evidence: ; Do you have severe Chronic Obstructive Pulmonary Disease (COPD)? Yes; Are you experiencing shortness of breath or difficulty breathing in a significant way? Yes; Have you had one or several flare ups of chronic obstructive pulmonary disease (COPD) in the past year? Yes; Do you have a cough that produces colored or more abundant sputum than usual? Yes; Do you smoke cigarettes? Yes; Do you have a chronic obstructive pulmonary disease (COPD)? Yes; Do you work in construction? Yes; Do you have a cough? Yes; Have you traveled out of the country in the last 4 weeks? N; Have you noticed a wheezing sound when you exhale? Yes
cluster headache,Influenza,"Age: 36; Sex: M; Initial evidence: Have you had significantly increased sweating? Yes; Evidence: ; Have you had significantly increased sweating? Yes; Do you have pain somewhere, related to your reason for consulting? Yes; Characterize your pain: sensitive; Characterize your pain: exhausting; Do you feel pain somewhere? back of head; Do you feel pain somewhere? back of the neck; Do you feel pain somewhere? side of the neck(R); Do you feel pain somewhere? forehead; Do you feel pain somewhere? occiput; How intense is the pain? 6; Does the pain radiate to another location? nowhere; How precisely is the pain located? 6; How fast did the pain appear? 6; Do you have a fever (either felt or measured with a thermometer)? Yes; Have you had chills or shivers? Yes; Do you have a sore throat? Yes; Do you have any lesions, redness or problems on your skin that you believe are related to the condition you are consulting for? Yes; What color is the rash? pink; Do your lesions peel off? N; Is the rash swollen? 2; Where is the affected region located? back of the neck; Where is the affected region located? side of the neck(R); Where is the affected region located? forehead; How intense is the pain caused by the rash? 0; Is the lesion (or are the lesions) larger than 1cm? Y; How severe is the itching? 2; Do you have diffuse (widespread) muscle pain? Yes; Have you recently had a loss of appetite or do you get full more quickly then usually? Yes; Do you have nasal congestion or a clear runny nose? Yes; Do you have a cough? Yes; Have you traveled out of the country in the last 4 weeks? N"
acute bronchitis,Localized edema,"Age: 28; Sex: F; Initial evidence: Do you have pain somewhere, related to your reason for consulting? Yes; Evidence: ; Are you currently taking or have you recently taken anti-inflammatory drugs (NSAIDs)? Yes; Do you have pain somewhere, related to your reason for consulting? Yes; Characterize your pain: tedious; Characterize your pain: sensitive; Characterize your pain: tugging; Characterize your pain: heavy; Do you feel pain somewhere? ankle(L); Do you feel pain somewhere? thigh(R); Do you feel pain somewhere? thigh(L); Do you feel pain somewhere? sole(R); Do you feel pain somewhere? sole(L); How intense is the pain? 8; Does the pain radiate to another location? nowhere; How precisely is the pain located? 4; How fast did the pain appear? 7; Have you gained weight recently? Yes; Do you have heart failure? Yes; Have you ever had deep vein thrombosis (DVT)? Yes; Have you ever had surgery to remove lymph nodes? Yes; Do you take a calcium channel blockers (medication)? Yes; Do you have swelling in one or more areas of your body? Yes; Where is the swelling located? ankle(R); Where is the swelling located? ankle(L); Where is the swelling located? thigh(R); Where is the swelling located? thigh(L); Where is the swelling located? dorsal aspect of the foot(L); Have you ever been diagnosed with obstructive sleep apnea (OSA)? Yes; Do you have a known kidney problem resulting in an inability to retain proteins? Yes; Have you traveled out of the country in the last 4 weeks? N"
acute anxiety attack,Panic attack,"Age: 69; Sex: F; Initial evidence: Have you recently had numbness, loss of sensation or tingling, in both arms and legs and around your mouth? Yes; Evidence: ; Do you feel anxious? Yes; Do any members of your immediate family have a psychiatric illness? Yes; Have you had significantly increased sweating? Yes; Do you have pain somewhere, related to your reason for consulting? Yes; Characterize your pain: sharp; Do you feel pain somewhere? side of the chest(L); Do you feel pain somewhere? flank(R); Do you feel pain somewhere? iliac fossa(R); Do you feel pain somewhere? hypochondrium(L); Do you feel pain somewhere? pubis; How intense is the pain? 5; Does the pain radiate to another location? nowhere; How precisely is the pain located? 7; How fast did the pain appear? 5; Do you suffer from chronic anxiety? Yes; Have you ever had a migraine or is a member of your family known to have migraines? Yes; Do you feel like you are dying or were you afraid that you were about do die? Yes; Do you have asthma or have you ever had to use a bronchodilator in the past? Yes; Do you suffer from fibromyalgia? Yes; Do you feel your heart is beating fast (racing), irregularly (missing a beat) or do you feel palpitations? Yes; Have you recently had numbness, loss of sensation or tingling, in both arms and legs and around your mouth? Yes; Do you feel like you are detached from your own body or your surroundings? Yes; Have you ever had a head trauma? Yes; Have you traveled out of the country in the last 4 weeks? N"
spontaneous pneumothorax,Acute otitis media,"Age: 6; Sex: F; Initial evidence: Do you have pain somewhere, related to your reason for consulting? Yes; Evidence: ; Are you currently being treated or have you recently been treated with an oral antibiotic for an ear infection? Yes; Do you have pain somewhere, related to your reason for consulting? Yes; Characterize your pain: sensitive; Do you feel pain somewhere? ear(R); Do you feel pain somewhere? ear(L); How intense is the pain? 3; Does the pain radiate to another location? nowhere; How precisely is the pain located? 8; How fast did the pain appear? 2; Have you traveled out of the country in the last 4 weeks? N; Are your vaccinations up to date? Yes"
tuberculosis,Bronchiectasis,Age: 46; Sex: M; Initial evidence: Do you have a cough that produces colored or more abundant sputum than usual? Yes; Evidence: ; Are you of Asian descent? Yes; Do you have Rheumatoid Arthritis? Yes; Do you suffer from Crohn’s disease or ulcerative colitis (UC)? Yes; Do you have a cough that produces colored or more abundant sputum than usual? Yes; Have you ever had pneumonia? Yes; Do you have a chronic obstructive pulmonary disease (COPD)? Yes; Do you have a cough? Yes; Have you traveled out of the country in the last 4 weeks? N; Are you immunosuppressed? Yes
cluster headache,Influenza,"Age: 18; Sex: M; Initial evidence: Have you had chills or shivers? Yes; Evidence: ; Have you had significantly increased sweating? Yes; Do you have pain somewhere, related to your reason for consulting? Yes; Characterize your pain: sensitive; Characterize your pain: exhausting; Do you feel pain somewhere? back of head; Do you feel pain somewhere? back of the neck; Do you feel pain somewhere? side of the neck(R); Do you feel pain somewhere? forehead; Do you feel pain somewhere? occiput; How intense is the pain? 6; Does the pain radiate to another location? nowhere; How precisely is the pain located? 7; How fast did the pain appear? 3; Do you smoke cigarettes? Yes; Do you feel so tired that you are unable to do your usual activities or are you stuck in your bed all day long? Yes; Do you have a fever (either felt or measured with a thermometer)? Yes; Have you had chills or shivers? Yes; Do you have a sore throat? Yes; Do you have any lesions, redness or problems on your skin that you believe are related to the condition you are consulting for? Yes; What color is the rash? pink; Do your lesions peel off? N; Is the rash swollen? 3; Where is the affected region located? back of the neck; How intense is the pain caused by the rash? 6; Is the lesion (or are the lesions) larger than 1cm? Y; How severe is the itching? 4; Do you have diffuse (widespread) muscle pain? Yes; Have you recently had a loss of appetite or do you get full more quickly then usually? Yes; Do you have nasal congestion or a clear runny nose? Yes; Do you have a cough? Yes; Have you traveled out of the country in the last 4 weeks? N"
anemia,Anemia,"Age: 30; Sex: M; Initial evidence: Do you feel so tired that you are unable to do your usual activities or are you stuck in your bed all day long? Yes; Evidence: ; Have you ever had a diagnosis of anemia? Yes; Do you have pain somewhere, related to your reason for consulting? Yes; Characterize your pain: sensitive; Characterize your pain: exhausting; Do you feel pain somewhere? forehead; How intense is the pain? 4; Does the pain radiate to another location? nowhere; How precisely is the pain located? 7; How fast did the pain appear? 0; Are you experiencing shortness of breath or difficulty breathing in a significant way? Yes; Do you feel lightheaded and dizzy or do you feel like you are about to faint? Yes; Do you feel so tired that you are unable to do your usual activities or are you stuck in your bed all day long? Yes; Do you constantly feel fatigued or do you have non-restful sleep? Yes; Do you have chronic kidney failure? Yes; Have you recently had stools that were black (like coal)? Yes; Are you taking any new oral anticoagulants ((NOACs)? Yes; Is your skin much paler than usual? Yes; Have you traveled out of the country in the last 4 weeks? Central America; Is your BMI less than 18.5, or are you underweight? Yes"
allergic rhinitis,Anaphylaxis,"Age: 47; Sex: F; Initial evidence: Do you have any lesions, redness or problems on your skin that you believe are related to the condition you are consulting for? Yes; Evidence: ; Do you have a known severe food allergy? Yes; Have you been in contact with or ate something that you have an allergy to? Yes; Have you had diarrhea or an increase in stool frequency? Yes; Do you have pain somewhere, related to your reason for consulting? Yes; Characterize your pain: a cramp; Characterize your pain: sharp; Do you feel pain somewhere? flank(R); Do you feel pain somewhere? iliac fossa(R); Do you feel pain somewhere? hypochondrium(R); Do you feel pain somewhere? belly; Do you feel pain somewhere? epigastric; How intense is the pain? 7; Does the pain radiate to another location? nowhere; How precisely is the pain located? 5; How fast did the pain appear? 7; Do you feel lightheaded and dizzy or do you feel like you are about to faint? Yes; Do you have any lesions, redness or problems on your skin that you believe are related to the condition you are consulting for? Yes; What color is the rash? pink; Do your lesions peel off? N; Is the rash swollen? 6; Where is the affected region located? back of the neck; Where is the affected region located? biceps(R); Where is the affected region located? biceps(L); Where is the affected region located? mouth; Where is the affected region located? ankle(R); How intense is the pain caused by the rash? 2; Is the lesion (or are the lesions) larger than 1cm? Y; How severe is the itching? 8; Are you feeling nauseous or do you feel like vomiting? Yes; Do you have swelling in one or more areas of your body? Yes; Where is the swelling located? forehead; Where is the swelling located? cheek(R); Where is the swelling located? cheek(L); Where is the swelling located? nose; Have you noticed a high pitched sound when breathing in? Yes; Have you traveled out of the country in the last 4 weeks? N; Have you noticed a wheezing sound when you exhale? Yes; Are you more likely to develop common allergies than the general population? Yes"
hiv (initial infection),HIV (initial infection),"Age: 52; Sex: F; Initial evidence: Have you had an involuntary weight loss over the last 3 months? Yes; Evidence: ; Do you have swollen or painful lymph nodes? Yes; Have you ever had a sexually transmitted infection? Yes; Have you had significantly increased sweating? Yes; Do you have pain somewhere, related to your reason for consulting? Yes; Characterize your pain: tedious; Characterize your pain: sensitive; Characterize your pain: a pulse; Characterize your pain: exhausting; Do you feel pain somewhere? back of head; Do you feel pain somewhere? top of the head; Do you feel pain somewhere? forehead; Do you feel pain somewhere? temple(R); How intense is the pain? 4; Does the pain radiate to another location? nowhere; How precisely is the pain located? 8; How fast did the pain appear? 6; Do you feel so tired that you are unable to do your usual activities or are you stuck in your bed all day long? Yes; Do you have a fever (either felt or measured with a thermometer)? Yes; Do you have a sore throat? Yes; Have you had unprotected sex with more than one partner in the last 6 months? Yes; Do you have any lesions, redness or problems on your skin that you believe are related to the condition you are consulting for? Yes; What color is the rash? pale; Do your lesions peel off? N; Is the rash swollen? 1; Where is the affected region located? lower gum; Where is the affected region located? upper gum; Where is the affected region located? labia majora(R); Where is the affected region located? labia majora(L); Where is the affected region located? internal cheek(R); How intense is the pain caused by the rash? 3; Is the lesion (or are the lesions) larger than 1cm? Y; How severe is the itching? 0; Have you had an involuntary weight loss over the last 3 months? Yes; Have you had sexual intercourse with an HIV-positive partner in the past 12 months? Yes; Have you traveled out of the country in the last 4 weeks? N"
bronchitis,URTI,"Age: 53; Sex: M; Initial evidence: Have you had significantly increased sweating? Yes; Evidence: ; Have you been in contact with a person with similar symptoms in the past 2 weeks? Yes; Do you attend or work in a daycare? Yes; Have you had significantly increased sweating? Yes; Do you have pain somewhere, related to your reason for consulting? Yes; Characterize your pain: tedious; Characterize your pain: sensitive; Characterize your pain: heavy; Do you feel pain somewhere? top of the head; Do you feel pain somewhere? forehead; Do you feel pain somewhere? cheek(L); Do you feel pain somewhere? temple(R); Do you feel pain somewhere? temple(L); How intense is the pain? 7; Does the pain radiate to another location? nowhere; How precisely is the pain located? 6; How fast did the pain appear? 3; Do you have a fever (either felt or measured with a thermometer)? Yes; Do you have a sore throat? Yes; Do you have diffuse (widespread) muscle pain? Yes; Have you traveled out of the country in the last 4 weeks? N; Are you exposed to secondhand cigarette smoke on a daily basis? Yes"
hyperthyroidism,Atrial fibrillation,Age: 26; Sex: M; Initial evidence: Do you feel your heart is beating very irregularly or in a disorganized pattern? Yes; Evidence: ; Have you been diagnosed with hyperthyroidism? Yes; Do you have a known issue with one of your heart valves? Yes; Do you have severe Chronic Obstructive Pulmonary Disease (COPD)? Yes; Are you experiencing shortness of breath or difficulty breathing in a significant way? Yes; Do you feel slightly dizzy or lightheaded? Yes; Have you ever had a heart attack or do you have angina (chest pain)? Yes; Do you feel your heart is beating very irregularly or in a disorganized pattern? Yes; Have you traveled out of the country in the last 4 weeks? N
acute bronchitis,Sarcoidosis,"Age: 88; Sex: F; Initial evidence: Do you have pain somewhere, related to your reason for consulting? Yes; Evidence: ; Do you have swollen or painful lymph nodes? Yes; Do you have pain somewhere, related to your reason for consulting? Yes; Characterize your pain: sensitive; Characterize your pain: burning; Do you feel pain somewhere? finger (ring finger)(L); Do you feel pain somewhere? finger (little finger)(R); Do you feel pain somewhere? finger (index)(R); Do you feel pain somewhere? finger (middle)(R); Do you feel pain somewhere? shoulder(R); How intense is the pain? 1; Does the pain radiate to another location? nowhere; How precisely is the pain located? 2; How fast did the pain appear? 3; Are you experiencing shortness of breath or difficulty breathing in a significant way? Yes; What color is the rash? NA; Do your lesions peel off? N; Is the rash swollen? 0; Where is the affected region located? nowhere; How intense is the pain caused by the rash? 0; Is the lesion (or are the lesions) larger than 1cm? N; How severe is the itching? 0; Have you had any vaginal discharge? Yes; Have you traveled out of the country in the last 4 weeks? N"
